{
  "experiment": "E07",
  "description": "Browser and local application state unavailable",
  "timestamp": "2026-09-23T16:00:12.500Z",
  "gitCommit": "aaa7b413fdc4fb373c03b835d4620f461e6d5a59",
  "gitDirty": true,
  "fixture": "research/fixtures/archives/passphrase-v1.arkive",
  "fixtureArchiveSha256": "1fe29c24402ff3e44b46882705bfceb86035295f3f81cb715823dc6878b705af",
  "removedDependencies": [
    "local_storage",
    "indexed_db",
    "browser_cache",
    "browser_session",
    "network"
  ],
  "availableDependencies": [
    "local_archive",
    "node_crypto",
    "arkive_recover",
    "test_credential"
  ],
  "expectedOutcome": "RECOVERY_SUCCESS",
  "expectedPlaintextSha256": "8e5ed1e6474d39bf1594411085e7a50c15aabaa768e633ebf0960ce20e84e336",
  "actualOutcome": "RECOVERY_SUCCESS",
  "errorClassification": null,
  "recoveredPlaintextSha256": "8e5ed1e6474d39bf1594411085e7a50c15aabaa768e633ebf0960ce20e84e336",
  "exactByteMatch": true,
  "externalEndpointsContacted": [],
  "durationMs": 144,
  "result": "PASS"
}
