{
  "experiment": "E11",
  "stage": "E11-A",
  "description": "Primary storage unavailable with an independent local replica",
  "timestamp": "2026-09-23T16:00:14.467Z",
  "gitCommit": "aaa7b413fdc4fb373c03b835d4620f461e6d5a59",
  "gitDirty": true,
  "fixture": "research/fixtures/archives/passphrase-v1.arkive",
  "fixtureArchiveSha256": "1fe29c24402ff3e44b46882705bfceb86035295f3f81cb715823dc6878b705af",
  "removedDependencies": [
    "primary_storage_provider",
    "network"
  ],
  "availableDependencies": [
    "independent_local_replica",
    "node_runtime",
    "arkive_recover",
    "test_credential"
  ],
  "expectedOutcome": "RECOVERY_SUCCESS_FROM_REPLICA",
  "actualOutcome": "RECOVERY_SUCCESS",
  "errorClassification": null,
  "primaryStorageAvailable": false,
  "replicaAvailable": true,
  "accessedLocations": [
    "independent-replica/archive.arkive",
    "fresh-recovery-environment/archive-from-replica.arkive"
  ],
  "primaryArchiveSha256BeforeRemoval": "1fe29c24402ff3e44b46882705bfceb86035295f3f81cb715823dc6878b705af",
  "replicaArchiveSha256": "1fe29c24402ff3e44b46882705bfceb86035295f3f81cb715823dc6878b705af",
  "expectedPlaintextSha256": "8e5ed1e6474d39bf1594411085e7a50c15aabaa768e633ebf0960ce20e84e336",
  "recoveredPlaintextSha256": "8e5ed1e6474d39bf1594411085e7a50c15aabaa768e633ebf0960ce20e84e336",
  "exactByteMatch": true,
  "externalEndpointsContacted": [],
  "durationMs": 186,
  "claimBoundary": "ARKIVE's encrypted archive object can be recovered from a storage location independent of its original storage path.",
  "excludedClaim": "This does not validate cross-network blockchain permanence or E11-B.",
  "result": "PASS"
}
