{
  "experiment": "E05",
  "description": "Original Arweave gateway unavailable",
  "timestamp": "2026-09-23T16:00:14.109Z",
  "gitCommit": "aaa7b413fdc4fb373c03b835d4620f461e6d5a59",
  "gitDirty": true,
  "fixture": "research/fixtures/archives/passphrase-v1.arkive",
  "fixtureArchiveSha256": "1fe29c24402ff3e44b46882705bfceb86035295f3f81cb715823dc6878b705af",
  "ciphertextSha256": "3fc5fa50254a506386add649abcf10f4f1139e21a501a55ca27d42eb4dcfe876",
  "transactionStorageIdentifier": null,
  "removedDependencies": [
    "primary_arweave_gateway"
  ],
  "availableDependencies": [],
  "expectedOutcome": "RECOVERY_SUCCESS",
  "actualOutcome": "ENVIRONMENT_UNAVAILABLE",
  "errorClassification": "The committed synthetic fixture has no Arweave transaction ID; creating one may require a funded upload and was not authorized.",
  "gatewayA": null,
  "gatewayB": null,
  "gatewayBIndependentOperatorEstablished": false,
  "retrievedArchiveASha256": null,
  "retrievedArchiveBSha256": null,
  "expectedPlaintextSha256": "8e5ed1e6474d39bf1594411085e7a50c15aabaa768e633ebf0960ce20e84e336",
  "recoveredPlaintextSha256": null,
  "exactByteMatch": null,
  "externalEndpointsContacted": [],
  "durationMs": 0,
  "result": "SKIPPED"
}
